{
  "$schema": "https://json-schema.org/draft/2020-12/schema",
  "$id": "https://openclaw-videofactory.local/schemas/video_workflow/topic_evidence.schema.json",
  "title": "Topic Evidence",
  "type": "object",
  "required": [
    "evidence_id",
    "topic_id",
    "claim",
    "sources",
    "confidence",
    "source",
    "provenance",
    "status",
    "schema_version"
  ],
  "properties": {
    "evidence_id": {
      "type": "string"
    },
    "topic_id": {
      "type": "string"
    },
    "claim": {
      "type": "string"
    },
    "sources": {
      "type": "array",
      "minItems": 1,
      "items": {
        "type": "object",
        "required": [
          "url",
          "retrieved_at"
        ],
        "properties": {
          "url": {
            "type": "string"
          },
          "retrieved_at": {
            "type": "string",
            "format": "date-time"
          },
          "publisher": {
            "type": "string"
          },
          "license": {
            "type": "string"
          }
        }
      }
    },
    "conflict_with": {
      "type": "array",
      "items": {
        "type": "string"
      }
    },
    "schema_version": {
      "type": "string",
      "const": "1.0"
    },
    "source": {
      "type": "object",
      "required": [
        "kind",
        "id"
      ],
      "properties": {
        "kind": {
          "type": "string",
          "enum": [
            "openclaw_skill",
            "provider_adapter",
            "human",
            "platform",
            "synthetic_fixture"
          ]
        },
        "id": {
          "type": "string"
        },
        "version": {
          "type": "string"
        }
      }
    },
    "provenance": {
      "type": "object",
      "properties": {
        "created_at": {
          "type": "string",
          "format": "date-time"
        },
        "created_by": {
          "type": "string"
        },
        "tool": {
          "type": "string"
        }
      }
    },
    "status": {
      "type": "string",
      "enum": [
        "draft",
        "active",
        "rejected",
        "superseded",
        "deprecated"
      ]
    },
    "confidence": {
      "type": "number",
      "minimum": 0,
      "maximum": 1
    },
    "validation_errors": {
      "type": "array",
      "items": {
        "type": "string"
      },
      "default": []
    }
  },
  "additionalProperties": false
}