{
  "evidence_id": "ev_conflict",
  "topic_id": "tc_0",
  "claim": "conflicting claim",
  "sources": [
    {
      "url": "https://example.com/a",
      "retrieved_at": "2026-07-30T07:18:14.500889+00:00",
      "publisher": "A",
      "license": "cc"
    }
  ],
  "conflict_with": [
    "ev_0"
  ],
  "schema_version": "1.0",
  "source": {
    "kind": "synthetic_fixture",
    "id": "v28-test"
  },
  "provenance": {
    "created_at": "2026-07-30T07:18:14.500889+00:00",
    "created_by": "test",
    "tool": "v28_schema_tests"
  },
  "status": "active",
  "confidence": 0.5
}